{
  "$schema": "https://json-schema.org/draft/2020-12/schema",
  "title": "Sprite Semantic Dictionary",
  "description": "Machine-readable semantic region map for canonical Asciicker sprites. Each file maps one sprite family's reference XP to named body regions, palette roles, and frame-local cell coordinates so that agents can safely execute semantic edits like 'make the shirt green' without touching unrelated regions.",
  "type": "object",
  "required": ["schema_version", "family", "reference_xp", "semantic_layer", "frame_w", "frame_h", "grid_layout", "palette_roles", "frames"],
  "properties": {
    "schema_version": {
      "type": "string",
      "const": "0.1.0",
      "description": "Schema version for forward compatibility"
    },
    "family": {
      "type": "string",
      "enum": ["player", "attack", "plydie", "wolfie", "wolack"],
      "description": "Sprite family name matching the bundle template system"
    },
    "reference_xp": {
      "type": "string",
      "description": "Repo-relative path to the canonical reference XP file"
    },
    "semantic_layer": {
      "type": "integer",
      "description": "0-based layer index containing the visual appearance data (typically L2)"
    },
    "frame_w": {
      "type": "integer",
      "description": "Width of a single frame in cells"
    },
    "frame_h": {
      "type": "integer",
      "description": "Height of a single frame in cells"
    },
    "grid_layout": {
      "type": "object",
      "required": ["angles", "projections", "anim_counts", "frames_per_row", "rows"],
      "properties": {
        "angles": { "type": "integer", "description": "Number of directional angles (typically 8)" },
        "projections": { "type": "integer", "description": "Number of projection variants (typically 2)" },
        "anim_counts": {
          "type": "array",
          "items": { "type": "integer" },
          "description": "Frame count per animation sequence (e.g. [1, 8] = 1 idle + 8 walk)"
        },
        "frames_per_row": { "type": "integer", "description": "Total frames per angle row" },
        "rows": { "type": "integer", "description": "Total angle rows in the sheet" }
      }
    },
    "palette_roles": {
      "type": "object",
      "description": "Named color roles with their representative hex colors. Keys are role names, values are role descriptors.",
      "additionalProperties": {
        "type": "object",
        "required": ["colors", "confidence", "description"],
        "properties": {
          "colors": {
            "type": "array",
            "items": { "type": "string", "pattern": "^#[0-9a-f]{6}$" },
            "description": "Representative hex colors for this role (may appear as fg or bg)"
          },
          "confidence": {
            "type": "string",
            "enum": ["high", "medium", "low"],
            "description": "Confidence level based on cross-frame verification"
          },
          "usage": {
            "type": "string",
            "enum": ["fg", "bg", "both"],
            "description": "Whether this color typically appears as foreground, background, or both"
          },
          "description": {
            "type": "string",
            "description": "Human-readable description of this palette role"
          },
          "slot": {
            "type": "string",
            "description": "Wearable slot this palette role belongs to, enabling scoped recoloring (e.g. 'recolor armor cells')"
          }
        }
      }
    },
    "frames": {
      "type": "object",
      "description": "Per-frame semantic region maps. Keys are frame indices as strings.",
      "additionalProperties": {
        "type": "object",
        "required": ["regions"],
        "properties": {
          "projection": { "type": "integer" },
          "angle": { "type": "integer" },
          "anim_index": { "type": "integer" },
          "anim_name": { "type": "string" },
          "regions": {
            "type": "array",
            "items": {
              "type": "object",
              "required": ["name", "bbox", "confidence", "palette_roles"],
              "properties": {
                "name": {
                  "type": "string",
                  "description": "Semantic region name (e.g. face, shirt, pants, boots, weapon)"
                },
                "bbox": {
                  "type": "array",
                  "items": { "type": "integer" },
                  "minItems": 4,
                  "maxItems": 4,
                  "description": "Bounding box in frame-local coords [x0, y0, x1, y1] inclusive"
                },
                "confidence": {
                  "type": "string",
                  "enum": ["high", "medium", "low"]
                },
                "palette_roles": {
                  "type": "array",
                  "items": { "type": "string" },
                  "description": "Palette role names active in this region"
                },
                "semantic_cells": {
                  "type": "array",
                  "items": {
                    "type": "object",
                    "required": ["x", "y", "glyph", "fg", "bg"],
                    "properties": {
                      "x": { "type": "integer" },
                      "y": { "type": "integer" },
                      "glyph": { "type": "integer", "description": "CP437 glyph index" },
                      "fg": { "type": "string", "pattern": "^#[0-9a-f]{6}$" },
                      "bg": { "type": "string", "pattern": "^#[0-9a-f]{6}$" },
                      "role": { "type": "string", "description": "Semantic role of this specific cell" },
                      "fg_region": { "type": "string", "description": "Foreground region for half-block transition cells where fg and bg belong to different body parts" },
                      "bg_region": { "type": "string", "description": "Background region for half-block transition cells where fg and bg belong to different body parts" }
                    }
                  },
                  "description": "Individually identified semantic cells within the region"
                },
                "slot_affinity": {
                  "type": "string",
                  "enum": ["body", "head", "shield", "weapon", "armor", "mount"],
                  "description": "Engine wearable slot this region maps to (from APPEARANCE_SLOT_KIND). Cells inherit slot affinity from their containing region."
                },
                "notes": {
                  "type": "string",
                  "description": "Optional notes about this region"
                }
              }
            }
          }
        }
      }
    },
    "ambiguities": {
      "type": "array",
      "items": { "type": "string" },
      "description": "Known ambiguities that require human verification"
    },
    "transparent_bg": {
      "type": "string",
      "pattern": "^#[0-9a-f]{6}$",
      "description": "Background color used for transparent/empty cells (REXPaint convention)"
    },
    "angle_anchors": {
      "type": "object",
      "description": "Metadata about which angles have ground-truth anchor data vs. propagated labels",
      "properties": {
        "ground_truth_angles": {
          "type": "array",
          "items": { "type": "integer" },
          "description": "Angle indices (0-7) with human-verified ground-truth region definitions"
        },
        "propagated_angles": {
          "type": "array",
          "items": { "type": "integer" },
          "description": "Angle indices with algorithmically propagated region labels"
        }
      }
    },
    "overlay_masks": {
      "type": "object",
      "description": "Per-overlay-slot coverage masks derived from cell-diff between body and overlay XP files. Keys are overlay slot names (e.g. 'armor', 'helmet').",
      "additionalProperties": {
        "type": "object",
        "description": "Per-angle coverage for one overlay slot. Keys are angle indices as strings.",
        "additionalProperties": {
          "type": "object",
          "properties": {
            "body_parts_covered": {
              "type": "array",
              "items": { "type": "string" },
              "description": "Body-part region names covered by this overlay at this angle"
            },
            "covered_cells": {
              "type": "array",
              "items": {
                "type": "array",
                "items": { "type": "integer" },
                "minItems": 2,
                "maxItems": 2
              },
              "description": "List of [x, y] cell coordinates covered by this overlay at this angle"
            },
            "slot_affinity": {
              "type": "string",
              "enum": ["body", "head", "shield", "weapon", "armor", "mount"],
              "description": "Inferred wearable slot for this overlay at this angle"
            }
          }
        }
      }
    }
  }
}
