{
  "schema_version": "0.1.0",
  "family": "plydie",
  "reference_xp": "../../../../sprites/plydie-0000.xp",
  "semantic_layer": 2,
  "frame_w": 11,
  "frame_h": 11,
  "grid_layout": {
    "angles": 8,
    "projections": 2,
    "anim_counts": [
      5
    ],
    "frames_per_row": 10,
    "rows": 8
  },
  "transparent_bg": "#ff00ff",
  "palette_roles": {
    "hair": {
      "colors": [
        "#000000"
      ],
      "confidence": "high",
      "usage": "fg",
      "description": "Black hair — same role as player family"
    },
    "subcell_fill": {
      "colors": [
        "#ffff55"
      ],
      "confidence": "high",
      "usage": "bg",
      "description": "Yellow sub-cell rendering fill — rendering technique color, not a body part"
    },
    "skin": {
      "colors": [
        "#ff5555"
      ],
      "confidence": "high",
      "usage": "bg",
      "description": "Flesh tone — same role as player family"
    },
    "skin_detail": {
      "colors": [
        "#aa0000"
      ],
      "confidence": "high",
      "usage": "fg",
      "description": "Dark red face detail — used for ^ expression glyph in death pose"
    },
    "shirt_primary": {
      "colors": [
        "#aa00aa"
      ],
      "confidence": "high",
      "usage": "both",
      "description": "Purple torso — same role as player family"
    },
    "pants_dark": {
      "colors": [
        "#0000aa"
      ],
      "confidence": "high",
      "usage": "both",
      "description": "Dark blue pants — same role as player family"
    },
    "pants_bright": {
      "colors": [
        "#5555ff"
      ],
      "confidence": "high",
      "usage": "fg",
      "description": "Bright blue pants highlight — same role as player family"
    },
    "boots_primary": {
      "colors": [
        "#aa5500"
      ],
      "confidence": "high",
      "usage": "fg",
      "description": "Brown boots — same role as player family"
    },
    "outline": {
      "colors": [
        "#000000"
      ],
      "confidence": "high",
      "usage": "both",
      "description": "Black outlines and accents"
    }
  },
  "frames": {
    "0": {
      "projection": 0,
      "angle": 0,
      "anim_index": 0,
      "anim_name": "death",
      "regions": [
        {
          "name": "hair",
          "bbox": [
            4,
            5,
            6,
            6
          ],
          "confidence": "medium",
          "palette_roles": [
            "skin",
            "subcell_fill"
          ],
          "semantic_cells": [
            {
              "x": 5,
              "y": 5,
              "glyph": 220,
              "fg": "#ff5555",
              "bg": "#ffff55",
              "role": "hair_face_transition"
            },
            {
              "x": 4,
              "y": 6,
              "glyph": 222,
              "fg": "#000000",
              "bg": "#ffff55",
              "role": "hair_left_edge"
            },
            {
              "x": 6,
              "y": 6,
              "glyph": 221,
              "fg": "#000000",
              "bg": "#ffff55",
              "role": "hair_right_edge"
            }
          ],
          "notes": "Single transition cell with skin fg and hair bg. In death pose, the head is more compact. Glyph 220 (▄) creates a half-block transition between hair (upper) and face (lower)."
        },
        {
          "name": "face",
          "bbox": [
            5,
            6,
            5,
            6
          ],
          "confidence": "high",
          "palette_roles": [
            "skin",
            "hair",
            "subcell_fill",
            "skin_detail",
            "outline"
          ],
          "semantic_cells": [
            {
              "x": 5,
              "y": 6,
              "glyph": 94,
              "fg": "#aa0000",
              "bg": "#ff5555",
              "role": "expression"
            }
          ],
          "notes": "Death pose face uses glyph 94 (^) instead of \" and v — different expression for death state. The ^ with dark-red fg on skin bg represents a grimace or closed expression. Same skin (#ff5555) and hair (#ffff55) colors as player family."
        },
        {
          "name": "shirt",
          "bbox": [
            4,
            7,
            6,
            7
          ],
          "confidence": "high",
          "palette_roles": [
            "shirt_primary",
            "skin"
          ],
          "semantic_cells": [
            {
              "x": 4,
              "y": 7,
              "glyph": 220,
              "fg": "#aa00aa",
              "bg": "#aa00aa",
              "role": "shirt_left"
            },
            {
              "x": 5,
              "y": 7,
              "glyph": 220,
              "fg": "#aa00aa",
              "bg": "#ff5555",
              "role": "shirt_center"
            },
            {
              "x": 6,
              "y": 7,
              "glyph": 220,
              "fg": "#aa00aa",
              "bg": "#aa00aa",
              "role": "shirt_right"
            }
          ],
          "notes": "Death pose spreads the torso horizontally. Arms at (3,7) and (7,7) use glyph 240 (≡) with skin bg — arms splayed out. Shirt center (5,7) shows skin bg bleeding through. Same purple (#aa00aa) as player."
        },
        {
          "name": "pants",
          "bbox": [
            4,
            8,
            6,
            9
          ],
          "confidence": "high",
          "palette_roles": [
            "pants_dark",
            "pants_bright",
            "shirt_primary"
          ],
          "semantic_cells": [
            {
              "x": 4,
              "y": 8,
              "glyph": 223,
              "fg": "#aa00aa",
              "bg": "#0000aa",
              "role": "pants_shirt_transition_left"
            },
            {
              "x": 5,
              "y": 8,
              "glyph": 220,
              "fg": "#5555ff",
              "bg": "#0000aa",
              "role": "pants_center"
            },
            {
              "x": 6,
              "y": 8,
              "glyph": 223,
              "fg": "#aa00aa",
              "bg": "#0000aa",
              "role": "pants_shirt_transition_right"
            },
            {
              "x": 5,
              "y": 9,
              "glyph": 223,
              "fg": "#0000aa",
              "bg": "#ffff55",
              "role": "pants_gap"
            }
          ],
          "notes": "Compact pants row. Transition cells at (4,8) and (6,8) blend shirt_primary fg with pants_dark bg. Same blue palette as player."
        },
        {
          "name": "boots",
          "bbox": [
            4,
            9,
            6,
            9
          ],
          "confidence": "high",
          "palette_roles": [
            "boots_primary",
            "outline",
            "pants_dark",
            "subcell_fill"
          ],
          "semantic_cells": [
            {
              "x": 4,
              "y": 9,
              "glyph": 223,
              "fg": "#aa5500",
              "bg": "#000000",
              "role": "boot_left"
            },
            {
              "x": 6,
              "y": 9,
              "glyph": 223,
              "fg": "#aa5500",
              "bg": "#000000",
              "role": "boot_right"
            }
          ],
          "notes": "Two boots with a center gap cell. Center cell (5,9) uses pants_dark fg on hair bg — this is a gap/ground cell between the boots, not part of the boots themselves. Same brown (#aa5500) as player."
        },
        {
          "name": "arms",
          "bbox": [
            3,
            7,
            7,
            7
          ],
          "confidence": "medium",
          "palette_roles": [
            "skin"
          ],
          "semantic_cells": [
            {
              "x": 3,
              "y": 7,
              "glyph": 240,
              "fg": "#000000",
              "bg": "#ff5555",
              "role": "arm_cell"
            },
            {
              "x": 7,
              "y": 7,
              "glyph": 240,
              "fg": "#000000",
              "bg": "#ff5555",
              "role": "arm_cell"
            }
          ]
        }
      ]
    }
  },
  "ambiguities": [
    "Death pose frame 0 appears to be the standing/initial death frame — later frames (1-4) likely show collapse animation with different body orientations",
    "The ^ (glyph 94) expression glyph is death-specific — semantically equivalent to the \" eyes and v mouth in the player idle pose but representing a different emotional state",
    "Glyph 240 (≡) at arm cells is death-specific — the arm representation changes between families/poses",
    "Center gap cell (5,9) between boots uses pants_dark fg — ambiguous whether this is 'pants bottom' or 'ground fill'; labeled as gap for safety",
    "Shirt center cell (5,7) uses skin bg (#ff5555) instead of shirt bg (#aa00aa) — this may represent skin visible through torn/open shirt in death pose, or it may be a rendering artifact",
    "Only 3 layers (L0-L2) vs 4 in player/attack — no L3 detail layer; plydie may use fewer visual layers by design",
    "Only frame 0 annotated; frames 1-4 of the death animation need separate annotation as body geometry changes significantly during collapse",
    "Other angle rows not annotated"
  ]
}
